Headline,Author
News Alerts,Accessibility statement
Democracy Dies in Darkness,Skip to main content
Try four weeks free,Democracy Dies in Darkness
Try four weeks free,Try four weeks free
,Sign in
,Logo of The Washington Post
ISRAEL-GAZA WAR,ISRAEL-GAZA WAR
,
,"Documents found on fighters reveal Hamas capabilities, bloody plans"
"Documents found on fighters reveal Hamas capabilities, bloody plans","A Hamas document lists instructions on operating weapons, identifies vulnerabilities in Israeli military equipment and offers tips on killing with a knife."
"A Hamas document lists instructions on operating weapons, identifies vulnerabilities in Israeli military equipment and offers tips on killing with a knife.",Loveday Morris
LIVE,Steve Hendrix
War prompts employees to demand U.S. companies take a side,LIVE
Biden hails freed U.S. hostages as family awaits reunion,10:48 a.m.Map: Latest updates in the conflict
"He rushed from Maryland to Israel to fight. On Friday, he was killed.",10:20 a.m.Shelling across the border between Israel and Lebanon continued Sunday. The Israel Defense Forces said that...
"With Americans’ release, Qatar revisits role as regional mediator",War prompts employees to demand U.S. companies take a side
Trump Cases,Biden hails freed U.S. hostages as family awaits reunion
,"He rushed from Maryland to Israel to fight. On Friday, he was killed."
,"With Americans’ release, Qatar revisits role as regional mediator"
Sidney Powell was Trump’s biggest ‘fighter.’ Now she’s a big threat.,Trump Cases
"Powell, who was angry that Trump didn’t act on her counsel, is the now government’s most prominent asset in its quest to convict him.",
MORE COVERAGE,Sidney Powell was Trump’s biggest ‘fighter.’ Now she’s a big threat.
MORE COVERAGE,"Powell, who was angry that Trump didn’t act on her counsel, is the now government’s most prominent asset in its quest to convict him."
Trump co-defendant Kenneth Chesebro pleads guilty in Georgia election case,Isaac Stanley-Becker
The pandemic is over in this Michigan county. The mistrust never ended.,Amy Gardner
Sierra Schuetz’s government job feeding the poor in conservative Ottawa County became a passion. Could it survive the suspicions that multiplied alongside covid?,Josh Dawsey
exclusive,Trump co-defendant Kenneth Chesebro pleads guilty in Georgia election case
,
,The pandemic is over in this Michigan county. The mistrust never ended.
exclusive,Sierra Schuetz’s government job feeding the poor in conservative Ottawa County became a passion. Could it survive the suspicions that multiplied alongside covid?
"Jim Jordan, a relentless wrestler on the mat and in Congress",Greg Jaffe
The former wrestling champion coached at Ohio State during the sex abuse scandal before entering politics.,Patrick Marley
MORE COVERAGE,
MORE COVERAGE,exclusive
Analysis: Jordan’s implosion in House speaker bid lays bare GOP civil war,"Jim Jordan, a relentless wrestler on the mat and in Congress"
"Concerns linger about election denialism amid Jordan’s contentious, failed bid",The former wrestling champion coached at Ohio State during the sex abuse scandal before entering politics.
Previous,David Maraniss
Next,Sally Jenkins
A surprising number of celebrities have worked as spies,Analysis: Jordan’s implosion in House speaker bid lays bare GOP civil war
How Apple TV’s ‘Lessons in Chemistry’ compares to the novel,"Concerns linger about election denialism amid Jordan’s contentious, failed bid"
Analysis,
College football winners and losers: Florida State remains the class of the ACC,A surprising number of celebrities have worked as spies
"8 allergy-friendly snacks for vegan, gluten-free and nut-free diets",
These identical twins dress alike daily. They are 84 years old.,How Apple TV’s ‘Lessons in Chemistry’ compares to the novel
Let us help you pick an audiobook. Here are clips of 3 new favorites.,Sophia Nguyen
Perspective,
How the 3-ingredient Negroni made being bitter more fun,Analysis
Latest from The Post,College football winners and losers: Florida State remains the class of the ACC
,
,"8 allergy-friendly snacks for vegan, gluten-free and nut-free diets"
Analysis,Becky Krystal
Virginia heated up a tepid day with its historic win at North Carolina,
1 hour ago,These identical twins dress alike daily. They are 84 years old.
Drugstore closures are leaving millions without easy access to a pharmacy,Sydney Page
A surprising number of celebrities have worked as spies,Loading...
ScaleAI wants to be America’s AI arms dealer,Let us help you pick an audiobook. Here are clips of 3 new favorites.
Israel-Gaza war prompts U.S. employees to demand companies take a side,Loading...
"He rushed from Maryland to Israel to fight. On Friday, he was killed.",Perspective
Va. is rolling out widespread school tutoring. Here’s how local districts are doing it.,How the 3-ingredient Negroni made being bitter more fun
"Va. voters focused on education, but less on trans students, poll finds",M. Carrie Allan
More from The Post,Latest from The Post
,
,Analysis
Opinions,Virginia heated up a tepid day with its historic win at North Carolina
,
,Drugstore closures are leaving millions without easy access to a pharmacy
What is the line between life and death? Here’s my answer.,
"U.S. law on determination of death needs refining, but how? Not behind closed doors.",A surprising number of celebrities have worked as spies
What ‘Killers of the Flower Moon’ taught my Oklahoma town,
Is Hamas winning the war?,ScaleAI wants to be America’s AI arms dealer
AI is learning from stolen intellectual property. It needs to stop.,
Cartoon: A pie chart of Republican infighting,Israel-Gaza war prompts U.S. employees to demand companies take a side
Post-grads: Waiting doesn’t have to be a waste of time,
House Republicans go down in flames — again,"He rushed from Maryland to Israel to fight. On Friday, he was killed."
More in opinions,
,Va. is rolling out widespread school tutoring. Here’s how local districts are doing it.
,
Only from The Post,"Va. voters focused on education, but less on trans students, poll finds"
Only from The Post,More from The Post
Previous,Opinions
Next,
Exclusive,What is the line between life and death? Here’s my answer.
,"U.S. law on determination of death needs refining, but how? Not behind closed doors."
,
Exclusive,What ‘Killers of the Flower Moon’ taught my Oklahoma town
Spy vs. spy: How Israelis tried to stop Russia’s information war in Africa,
The make-believe Republican primary,Is Hamas winning the war?
India uses widespread internet blackouts to mask domestic turmoil,
How Lunchables ended up on school lunch trays,AI is learning from stolen intellectual property. It needs to stop.
China is set to dominate the deep sea and its wealth of rare metals,
Jacksonville struggles to overcome a racism ‘baked into our culture’,Cartoon: A pie chart of Republican infighting
Lee Child leaves Jack Reacher in his brother’s hands,Edith Pritchett
Dolly Parton was told ‘gaudy’ clothes would hurt her career. She doubled down.,
Game Break,Post-grads: Waiting doesn’t have to be a waste of time
,Renee Yaseen
,
Keyword,House Republicans go down in flames — again
One word to spell them all.,Dana Milbank
On the Record,More in opinions
One quote. Three chances.,
Mini Meta Crossword,Exclusive
5x5 bitesized crossword.,Spy vs. spy: How Israelis tried to stop Russia’s information war in Africa
Sudoku,Elizabeth Dwoskin
Number. Order. Logic.,
NewsletterWeekdays,The make-believe Republican primary
Newsletter,Ben Terris
Weekdays,
"Get daily reminders for quizzes and games, plus insights into how other people scored.",India uses widespread internet blackouts to mask domestic turmoil
President of Detroit synagogue found stabbed to death outside home,Anant Gupta
"Biden wants help on migrants, but Mexico faces its own surge",Gerry Shih
‘Pharmacy deserts’ grow for millions of Americans as big chains close locations,
"Rite Aid, CVS and Walgreens have signaled plans to shutter more than 1,500 stores in the past two years, and public health experts say there’s already been fallout.",How Lunchables ended up on school lunch trays
Subtitle Settings,Lenny Bernstein
Analysis,Lauren Weber
A Formula One pit stop: 2 seconds of adrenaline and pressure,Dan Keating
"How it works, how Red Bull got to be the best and what Haas is doing to improve.",
What Taylor Swift superfans want you to understand,China is set to dominate the deep sea and its wealth of rare metals
"As Taylor Swift’s stardom has soared with the Eras Tour and movie premiere, longtime fans feel vindicated for their unwavering devotion.",Lily Kuo
Analysis,Loading...
"NFL primer: Anthony Richardson is out, and the Colts need to adjust",Jacksonville struggles to overcome a racism ‘baked into our culture’
Phillies blast past bullpen woes and are one win from the World Series,Lori Rozsa
REVIEWS,Loading...
REVIEWS,Lee Child leaves Jack Reacher in his brother’s hands
Previous,Sophia Nguyen
Next,Loading...
Movies,Dolly Parton was told ‘gaudy’ clothes would hurt her career. She doubled down.
The best movies of 2023 so far,Emily Yahr
Movies,Game Break
‘Killers of the Flower Moon’: An admirable yet vexingly uneven film,Keyword
Nonfiction,One word to spell them all.
How Marvel became the monoculture,
Movies,On the Record
‘The Persian Version’: Mother-daughter dramedy has an identity crisis,One quote. Three chances.
Art,
You can’t understand feminist art without seeing this show,Mini Meta Crossword
Movies,5x5 bitesized crossword.
‘Nyad’ is a celebration of perseverance and self-belief,
Music,Sudoku
The new Rolling Stones album actually sounds like the Rolling Stones,Number. Order. Logic.
Movies,
‘Dicks: The Musical’ gleefully embraces its grossness,Terms of Service
Restaurants,Privacy Policy
The flashy Philippe Chow is a mixed designer bag at the D.C.’s Wharf,
Fiction,President of Detroit synagogue found stabbed to death outside home
Jesmyn Ward revisits historical horrors with stunning lyricism,Yvonne Wingett Sanchez
FEATURED VIDEOS,Razzan Nakhlawi
FEATURED VIDEOS,
Watch All,"Biden wants help on migrants, but Mexico faces its own surge"
End of carousel,Mary Beth Sheridan
,
Most Read,‘Pharmacy deserts’ grow for millions of Americans as big chains close locations
Most Read,"Rite Aid, CVS and Walgreens have signaled plans to shutter more than 1,500 stores in the past two years, and public health experts say there’s already been fallout."
Sidney Powell was Trump’s biggest ‘fighter.’ Now she’s a big threat.,Aaron Gregg
"Powell, who was angry that Trump didn’t act on her counsel, is the now government’s most prominent asset in its quest to convict him.",Jaclyn Peiser
Relentless Wrestler,Analysis
The pandemic is over in this Michigan county. The mistrust never ended.,A Formula One pit stop: 2 seconds of adrenaline and pressure
"Documents found on fighters reveal Hamas capabilities, bloody plans","How it works, how Red Bull got to be the best and what Haas is doing to improve."
"He rushed from Maryland to Israel to fight. On Friday, he was killed.",Bonnie Berkowitz
,Artur Galocha
,
Election 2024,What Taylor Swift superfans want you to understand
,"As Taylor Swift’s stardom has soared with the Eras Tour and movie premiere, longtime fans feel vindicated for their unwavering devotion."
,Janay Kingsberry
"Haley threatens to overtake DeSantis as Trump alternative, sending sparks flying",
Escalating frictions between the two candidates are playing out before voters on the campaign trail and behind closed doors with wealthy donors.,Analysis
Biden team looks at buying more ads amid ongoing polling concerns,"NFL primer: Anthony Richardson is out, and the Colts need to adjust"
"Republicans target visas of student protesters. That violates free speech, experts say.",Mark Maske
Politics,
,Phillies blast past bullpen woes and are one win from the World Series
,Chelsea Janes
Analysis,
"Split-screen: Biden speaks to the world, Republicans can’t pick a leader",Movies
"Concerns linger about election denialism amid Jordan’s contentious, failed bid",The best movies of 2023 so far
Biden unveils $106 billion foreign aid package,
Advice,Movies
,‘Killers of the Flower Moon’: An admirable yet vexingly uneven film
,Ann Hornaday
Carolyn Hax: Protective mom wants to intervene in teen daughter’s friend drama,
October 22,Nonfiction
Miss Manners: When can I toss items guests leave at my home?,How Marvel became the monoculture
October 21,Becca Rothfeld
Ask Amy: Is it a genuine invite if we have to stay in an Airbnb?,
October 22,Movies
Previous,‘The Persian Version’: Mother-daughter dramedy has an identity crisis
Next,Michael O'Sullivan
How to try van life without buying a van,
How to plan a multigenerational trip and still like your family,Art
How to upgrade a powder room before the holidays? A pro took questions.,You can’t understand feminist art without seeing this show
Ask Sahaj: My fiancé says it’s my problem his mom is upset I don’t keep in touch,Sebastian Smee
Cooking chat: What’s the secret to getting breading to stick to meat?,Loading...
Do you know how to tip? Take this quiz to find out.,Movies
"Puberty starts earlier now, but kids’ needs are the same",‘Nyad’ is a celebration of perseverance and self-belief
Carolyn Hax chat: I’m about to get my PhD. My lawyer dad thinks I’m a failure.,Ann Hornaday
Can — and should — you caulk windows where metal meets wood?,Loading...
Design chat: Kelly Wearstler answered questions on soulful decorating,Music
More in advice,The new Rolling Stones album actually sounds like the Rolling Stones
,Chris Richards
,Loading...
Your questions answered,Movies
,‘Dicks: The Musical’ gleefully embraces its grossness
,Michael O'Sullivan
Recent,Loading...
Is AI the key to deciphering ancient artifacts? Stories readers adored this week.,Restaurants
What’s going on with the speaker race? Perry Bacon Jr. answered your questions.,The flashy Philippe Chow is a mixed designer bag at the D.C.’s Wharf
Featured,Tom Sietsema
Cooking chat: What’s the secret to getting breading to stick to meat?,Loading...
More in live chats,Fiction
,Jesmyn Ward revisits historical horrors with stunning lyricism
,Ron Charles
Well+Being,Press Enter to skip to end of carousel
,
,Sidney Powell was Trump’s biggest ‘fighter.’ Now she’s a big threat.
News and advice to live well every day,"Powell, who was angry that Trump didn’t act on her counsel, is the now government’s most prominent asset in its quest to convict him."
News and advice to live well every day,Relentless Wrestler
NewsletterTHURSDAYS,The pandemic is over in this Michigan county. The mistrust never ended.
Newsletter,"Documents found on fighters reveal Hamas capabilities, bloody plans"
THURSDAYS,"He rushed from Maryland to Israel to fight. On Friday, he was killed."
Advice,Election 2024
"When a partner’s snoring wrecks your sleep, these tips can help",
Skipping sleep? 5 hours or less raises depression risk in older adults.,"Haley threatens to overtake DeSantis as Trump alternative, sending sparks flying"
Overtalking may signal a mental health condition,Escalating frictions between the two candidates are playing out before voters on the campaign trail and behind closed doors with wealthy donors.
"Aging well, golf injuries and toilet paper: The week in Well+Being",Maeve Reston
The modern golf swing is powerful but can hurt your back. Here’s how to prevent injuries.,Hannah Knowles
AMERICA’S LIFE EXPECTANCY CRISIS,Dylan Wells
AMERICA’S LIFE EXPECTANCY CRISIS,Biden team looks at buying more ads amid ongoing polling concerns
Previous,Michael Scherer
Next,Tyler Pager
Compare your life expectancy with others around the world,"Republicans target visas of student protesters. That violates free speech, experts say."
"A tale of two sisters, two countries and their health systems",Dylan Wells
Stress is weathering our bodies from the inside out,Politics
How Lunchables ended up on school lunch trays,Analysis
America’s epidemic of chronic illness is killing us too soon,"Split-screen: Biden speaks to the world, Republicans can’t pick a leader"
How red-state politics are shaving years off American lives,Dan Balz
Fatty liver was a disease of the old. Then kids started getting sick.,"Concerns linger about election denialism amid Jordan’s contentious, failed bid"
The Home You Own,Jacqueline Alemany
,Biden unveils $106 billion foreign aid package
,Jeff Stein
7 white paint colors that interior designers love,Jacob Bogage
8 types of household filters you may be forgetting to clean,Advice
You need to clean your carpet — but hiring a pro may be unnecessary,Carolyn Hax: Protective mom wants to intervene in teen daughter’s friend drama
How to choose paint colors based on your home’s style and era,Miss Manners: When can I toss items guests leave at my home?
Advice,Ask Amy: Is it a genuine invite if we have to stay in an Airbnb?
How to remove stains from marble and other natural stone surfaces,
BOOK WORLD,How to try van life without buying a van
,
,How to plan a multigenerational trip and still like your family
"News, reviews and big ideas for all things fiction and nonfiction",
"News, reviews and big ideas for all things fiction and nonfiction",How to upgrade a powder room before the holidays? A pro took questions.
Let us help you pick an audiobook. Here are clips of 3 new favorites.,
Review,Ask Sahaj: My fiancé says it’s my problem his mom is upset I don’t keep in touch
Siskel and Ebert: The most influential voices in film history?,Loading...
Review,Cooking chat: What’s the secret to getting breading to stick to meat?
A riveting history of the Japanese war crimes trial after World War II,Loading...
Review,Do you know how to tip? Take this quiz to find out.
"‘How to Be’ sounds like a self-help book, but it’s more than that",Loading...
How ‘Airplane!’ became a first-class spoof,"Puberty starts earlier now, but kids’ needs are the same"
Climate,Loading...
,Carolyn Hax chat: I’m about to get my PhD. My lawyer dad thinks I’m a failure.
,Loading...
Expanded coverage of a changing planet,Can — and should — you caulk windows where metal meets wood?
Expanded coverage of a changing planet,Loading...
A lake is filled with oil. Thousands donated their hair to help soak it up.,Design chat: Kelly Wearstler answered questions on soulful decorating
NOAA cites environmental impact of rockets in Earth’s stratosphere,More in advice
This volcanic eruption reached so high it depleted the ozone layer,Your questions answered
"Lead pollution from small planes threatens human health, EPA finds",
How plants communicate with each other when in danger,Recent
More in climate,Is AI the key to deciphering ancient artifacts? Stories readers adored this week.
,
,What’s going on with the speaker race? Perry Bacon Jr. answered your questions.
Weather & Sky,
,Featured
,Cooking chat: What’s the secret to getting breading to stick to meat?
Tammy strikes Lesser Antilles while Norma lashes Cabo San Lucas,More in live chats
Northeast cities can’t catch a break from weekend rain. Here’s why.,Well+Being
"Atlantic hurricanes intensifying faster, more frequently, research finds",Terms of Service
When will the 2023 Atlantic hurricane season finally be over?,Privacy Policy
More in weather,
,Advice
,"When a partner’s snoring wrecks your sleep, these tips can help"
Help Desk,
,Skipping sleep? 5 hours or less raises depression risk in older adults.
,Teddy Amenabar
Analysis,
This is the best AI technology you’re probably not using,Overtalking may signal a mental health condition
Death by a thousand meetings: How to reduce video-call overload,
Google just changed how you log in to your account,"Aging well, golf injuries and toilet paper: The week in Well+Being"
Newsletter2X A WEEK,Tara Parker-Pope
Newsletter,
2X A WEEK,The modern golf swing is powerful but can hurt your back. Here’s how to prevent injuries.
The Help Desk gives you straight talk and advice to make technology better serve you and our world.,Gretchen Reynolds
Technology,Teddy Amenabar
,William Neff
,
ScaleAI wants to be America’s AI arms dealer,Compare your life expectancy with others around the world
Supreme Court says White House may continue requests to tech companies,Frances Stead Sellers
Newspapers want payment for articles used to power ChatGPT,Adam Taylor
The Washington Post,Dan Keating
National,Leslie Shapiro
,Carson TerBush
,
"Prominent pathologist at Johns Hopkins on leave, facing bullying claims","A tale of two sisters, two countries and their health systems"
The enduring family trauma behind ‘Killers of the Flower Moon’,Frances Stead Sellers
"U.S. payments on debt spike to $659 billion, nearly doubling in two years",
Drugstore closures are leaving millions without easy access to a pharmacy,Stress is weathering our bodies from the inside out
Jacksonville struggles to overcome a racism ‘baked into our culture’,Akilah Johnson
WORLD,
,How Lunchables ended up on school lunch trays
,Lenny Bernstein
"In Taiwan, finding solace — and identity — in traditional healing",Lauren Weber
Is Argentina about to elect a Trump-admiring outsider president?,Dan Keating
Pakistan’s ex-premier returns from self-exile to country in turmoil,
"Russian tycoon claims he is behind Forbes purchase, audiotapes show",America’s epidemic of chronic illness is killing us too soon
"Russia, shifting tactics, fans doubt in election integrity, U.S. says",Joel Achenbach
ISRAEL-GAZA WAR,Dan Keating
,Laurie McGinley
,Akilah Johnson
Previous,Jahi Chikwendiu
Next,Loading...
"After two American hostages are freed, hope and anguish remain in Israel",How red-state politics are shaving years off American lives
Why Egypt’s Rafah border crossing is vital for Gaza crisis,Lauren Weber
How did McDonald’s become a new flashpoint in the Israel-Hamas war?,Dan Diamond
Jewish schools adjust security as Israel-Gaza war stokes fears,Dan Keating
University leaders search for the right words amid Israel-Gaza war,Loading...
Hundreds of Americans trapped in Gaza with ‘no place safe for us to go’,Fatty liver was a disease of the old. Then kids started getting sick.
"Republicans target visas of student protesters. That violates free speech, experts say.",Ariana Eunjung Cha
What a ground war in Gaza could look like,The Home You Own
"As Gaza crisis escalates, some experts fear a Hamas ‘surprise’",
The media navigates a war of words for reporting on Gaza and Israel,7 white paint colors that interior designers love
Style,
,8 types of household filters you may be forgetting to clean
,
News from the front lines of culture,You need to clean your carpet — but hiring a pro may be unnecessary
News from the front lines of culture,Laura Daily
How a wacky Instagram account became a go-to news source,
"If it’s happening in Miami, locals find out about it through Only in Dade, previously a hub for alligator sightings and nightclub antics. Is this the future of local journalism?",How to choose paint colors based on your home’s style and era
Newsletter3X A WEEK,
Newsletter,Advice
3X A WEEK,How to remove stains from marble and other natural stone surfaces
"Style memo: Know what’s new and what’s next with sharp, funny and thoughtful coverage of entertainment, culture, media, power and fashion.",Jeanne Huber
Review,BOOK WORLD
The new Rolling Stones album actually sounds like the Rolling Stones,
How a Beyoncé dancemaker ended up on the Yellow Brick Road,Let us help you pick an audiobook. Here are clips of 3 new favorites.
More in Style,
,Review
,Siskel and Ebert: The most influential voices in film history?
HALLOWEEN,
HALLOWEEN,Review
Previous,A riveting history of the Japanese war crimes trial after World War II
Next,
"The best Halloween candy, according to our staff",Review
The 29 best things to do in D.C. this weekend and next week,"‘How to Be’ sounds like a self-help book, but it’s more than that"
8 Halloween recipes to help you scare up a ghoulish party,
"Behold the mystery of Lewis, Target’s talking pumpkin ghoul",How ‘Airplane!’ became a first-class spoof
6 Halloween cocktails for a spirited celebration,Climate
"It’s decorative gourd season, and this man is not playing around",
Review,A lake is filled with oil. Thousands donated their hair to help soak it up.
‘The Fall of the House of Usher’ is a Halloween ‘Christmas Story’,María Luisa Paúl
"Home Depot just can’t top Skelly, the 12-foot king of Halloween",
"Spooky hotels, haunted battlefields, Dracula’s castle: Readers’ scariest trips",NOAA cites environmental impact of rockets in Earth’s stratosphere
Review,
’Tis the season for horror and weird tales. Here are some favorites.,This volcanic eruption reached so high it depleted the ozone layer
"D.C., MD. & VA.",Kasha Patel
,
,"Lead pollution from small planes threatens human health, EPA finds"
"Va. voters focused on education, but less on trans students, poll finds",Timothy Puko
Va. is rolling out widespread school tutoring. Here’s how local districts are doing it.,Lori Aratani
"He rushed from Maryland to Israel to fight. On Friday, he was killed.",
Perspective,How plants communicate with each other when in danger
"In a historic cemetery, a groundskeeper will rest among congressmen",Kasha Patel
Police locate car last operated by man suspected of killing Md. judge,More in climate
Capital Weather Gang,Weather & Sky
D.C.-area forecast: A ton of sun this week with steadily warming temperatures,
The 29 best things to do in D.C. this weekend and next week,Tammy strikes Lesser Antilles while Norma lashes Cabo San Lucas
SPORTS,Matthew Cappucci
,
,Northeast cities can’t catch a break from weekend rain. Here’s why.
Analysis,Dan Stillman
Virginia heated up a tepid day with its historic win at North Carolina,
